,Index_page,ID,Date_publication,Title_and_author,Language_of_the_work,Word,Chapter,Hits,Requiered_tags,Additionnal_tags
0,86,44483077,23 Jan 2023, Kickstart My Heart by curiouser_n_curiouser ,English,"23,580",21/?,6221,"| Mature| Choose Not To Use Archive Warnings| F/F, F/M, M/M| Work in Progress|","|Creator Chose Not To Use Archive WarningsSteve Harrington/Eddie Munson Joyce Byers/Jim ""Chief"" Hopper Robin Buckley & Steve Harrington Jonathan Byers/Nancy Wheeler Steve Harrington & Jim ""Chief"" Hopper Joyce Byers & Steve HarringtonSteve Harrington Eddie Munson Jim ""Chief"" Hopper Joyce Byers Murray Bauman Dmitri Antonov Nancy Wheeler Jonathan Byers Dustin Henderson Maxine ""Max"" Mayfield Will Byers Mike Wheeler Lucas Sinclair Erica Sinclair Eleven | Jane Hopper Argyle (Stranger Things)Hurt Steve Harrington Major Character Injury Vampire Steve Harrington Angst Getting Together Blood and Gore Violence Not Canon Compliant Eddie Munson Lives Post-Traumatic Stress Disorder - PTSD Anxiety Nightmares Hurt/Comfort Brotherly Steve Harrington Steve Harrington Needs a Hug Bisexual Steve Harrington Steve Harrington is a Sweetheart Pansexual Eddie Munson Lesbian Robin Buckley Established Joyce Byers/Jim ""Chief"" Hopper Steve Harrington-centric Steve Harrington Has Bad Parents Eddie Munson Has ADHD Good Parent Joyce Byers Touch-Starved Steve Harrington Eddie Munson Takes Care of Steve Harrington Implied/Referenced Self-Harm Implied/Referenced Child Abuse Steve Harrington Has a Sexuality Crisis Self-Mutilation Self-Harm Good Parent Wayne Munson Slow Burn Gay Eddie Munson Body Horror Seizures Smut Eventual Smut Blood Kink Blood Drinking Kink Exploration Kink Discovery Explicit Sexual Content Dead Dove: Do Not Eat Bottom Steve Harrington Top Steve Harrington Bottom Eddie Munson Top Eddie Munson Biting Sadism Masochism|"
1,86,44482186,23 Jan 2023, Can you Hold me Until I Forget? by arminsupremacy ,English,"1,379",2/?,194,| Mature| Graphic Depictions Of Violence| M/M| Work in Progress|,"|Graphic Depictions Of ViolenceWill Byers/Mike WheelerWill Byers Mike Wheeler The Party (Stranger Things) Joyce Byers Lonnie Byers Jim ""Chief"" Hopper Eleven | Jane Hopper Nancy Wheeler Jonathan ByersWill Byers Needs a Hug Mike Wheeler Loves Will Byers Will Byers Loves Mike Wheeler Implied/Referenced Child Abuse PTSD Will Byers Has PTSD Will Byers Has Nightmares Implied/Referenced Self-Harm Hurt/Comfort Angst Fluff and Angst Eventual Smut Angst with a Happy Ending Will Byers finally let’s his emotions out Will Byers has every right to be angry Boys In Love|"
2,86,43059594,23 Jan 2023, Like You Used To by revengeandotherdrugs ,English,"5,708",2/6,133,| Explicit| Choose Not To Use Archive Warnings| M/M| Work in Progress|,|Creator Chose Not To Use Archive WarningsSteve Harrington/Eddie Munson Chrissy Cunningham & Eddie Munson Minor or Background Relationship(s)Eddie Munson Steve Harrington Chrissy Cunningham Robin Buckley Nancy Wheeler Jonathan ByersKid Fic But It's Not Actually His Kid I'm Not The Step Dad I'm The Dad Who Stepped Up Alternate Universe - Everyone Lives/Nobody Dies Or More Accurately only Some People Die Alternate Universe - No Upside Down (Stranger Things) Capital Punishment Post-Traumatic Stress Disorder - PTSD Injury Recovery Past Violence Past Torture Getting Back Together Gay Eddie Munson Marriage of Convenience BAMF Chrissy Cunningham|
3,86,44399380,23 Jan 2023, Four Rules by alternatedoom ,English,"8,696",1/1,471,| Mature| Underage| M/M| Complete Work|,"|UnderageWill Byers & Jim ""Chief"" Hopper Will Byers/Original Male Character(s)Will Byers Jim ""Chief"" HopperStatutory Rape Anal Sex Cruising Public Sex Caught having Sex Homophobic Language Angry Will Byers Good Parent Jim ""Chief"" Hopper Or At Least He's Trying Really Hard Homophobia Internalized Homophobia Not Beta Read Stranger Things Kinkmeme|"
4,86,44482075,23 Jan 2023, Hawkins Will Not Fall by TheNextDoorNerd ,English,"6,815",1/?,195,| Mature| Choose Not To Use Archive Warnings| Gen| Work in Progress|,"|Creator Chose Not To Use Archive WarningsNumber Five | The Boy (Umbrella Academy) & The Party (Stranger Things) Diego Hargreeves & Eleven | Jane Hopper Allison Hargreeves & Vanya Hargreeves | Viktor Hargreeves & Joyce Byers & Murray Bauman Luther Hargreeves & Jim “Chief” Hopper & Dmitri Antonov Klaus Hargreeves & Murray Bauman Klaus Hargreeves & Number Six | Ben Hargreeves Klaus Hargreeves & Will Byers & Jonathan Byers & Mike Wheeler & Argyle The Handler & Lila Pitts Number Five | The Boy & Hazel (Umbrella Academy) Hazel/Agnes Rofa Jonathan Byers/Nancy Wheeler Eleven | Jane Hopper/Mike Wheeler Joyce Byers/Jim ""Chief"" HopperLuther Hargreeves Diego Hargreeves Allison Hargreeves Klaus Hargreeves Number Five | The Boy (Umbrella Academy) Number Six | Ben Hargreeves Vanya Hargreeves | Viktor Hargreeves Lila Pitts Hazel (Umbrella Academy) Agnes Rofa The Handler (Umbrella Academy) Eleven | Jane Hopper Mike Wheeler Will Byers Dustin Henderson Lucas Sinclair Maxine ""Max"" Mayfield Steve Harrington Robin Buckley Nancy Wheeler Eddie Munson Erica Sinclair Argyle (Stranger Things) Jason Carver Joyce Byers Jim ""Chief"" Hopper Murray Bauman Dmitri Antonov Yuri Ismaylov Martin Brenner Henry Creel | One | Vecna Sam Owens (Stranger Things)Crossover Friendship Canon-Typical Violence Post-Traumatic Stress Disorder - PTSD Protective The Hargreeves | Umbrella Academy BAMF The Hargreeves | Umbrella Academy Soft Diego Hargreeves Sober Klaus Hargreeves Number Five | The Boy Needs A Hug Number Five | The Boy Being an Asshole Good Sibling Number Six | Ben Hargreeves Will Byers Deserves Love BAMF Eleven | Jane Hopper Eleven | Jane Hopper Needs a Hug Mike Wheeler Being an Idiot BAMF Nancy Wheeler Eddie Munson is a Sweetheart Maxine ""Max"" Mayfield Needs a Hug Martin Brenner Being an Asshole Not Beta Read|"
5,86,44482087,23 Jan 2023, carve your name into my chest by hexiewrites ,English,"42,868",8/8,7135,| Explicit| No Archive Warnings Apply| M/M| Complete Work|,|No Archive Warnings ApplySteve Harrington/Eddie MunsonSteve Harrington Eddie Munson Gareth (Stranger Things) Jeff (Stranger Things) Archie (Stranger Things) Robin Buckley Nancy Wheeler Jason CarverHockey Alternate Universe - Hockey Alternate Universe - Modern Setting Enemies to Lovers Fuckbuddies Hate Sex Enemies to Fuckbuddies to Friends to Lovers Soft Dom Steve Harrington Smut Anal Sex Blow Jobs Homophobia Internalized Homophobia Slurs Typical Hockey Violence Alternate Universe - No Upside Down (Stranger Things) POV Eddie Munson hockey player eddie munson Hockey Player Steve Harrington Switch Eddie Munson Switch Steve Harrington Minor Robin Buckley/Nancy Wheeler idiots to lovers|
6,86,17794088,23 Jan 2023, Mastermind by citrusmuppet ,English,"18,587",3/?,429,| Mature| Choose Not To Use Archive Warnings| M/M| Work in Progress|,"|Creator Chose Not To Use Archive WarningsSteve Harrington/Eddie Munson Robin Buckley/Nancy Wheeler Joyce Byers/Jim ""Chief"" HopperSteve Harrington Eddie Munson Robin Buckley Nancy Wheeler Joyce Byers Jim ""Chief"" Hopper Jonathan Byers Will Byers Dustin Henderson Maxine ""Max"" Mayfield Argyle (Stranger Things) Gareth (Stranger Things) Jeff (Stranger Things) Unnamed Freak (Stranger Things) Dmitri Antonov Yuri Ismaylov Murray Bauman Chrissy CunninghamAlternate Universe - Modern Setting Con Artist Steve Harrington Rock Star Eddie Munson Las Vegas Based on a Taylor Swift Song Robin Buckley & Steve Harrington Are Best Friends Steve Harrington is Dustin Henderson's Parent The Las Vegas Hotel is called 'The Lab' Chrissy Cunningham & Eddie Munson Friendship Past Domestic Violence Past Steve Harrington/Nancy Wheeler Past Billy Hargrove/Steve Harrington not beta'd we die like anyone with a 'b'|"
7,86,43855402,23 Jan 2023, Random Stuff with Random People by Skates ,English,729,4/?,31,"| Not Rated| Choose Not To Use Archive Warnings| F/F, F/M, Gen, M/M, Multi| Work in Progress|",|Creator Chose Not To Use Archive Warningsgay shit - Relationship not gay shit no shit at allI’m not listing them all here just look at the fandomsrandom shit headcannons non-canonical stuff canonical stuff gender stuff Sexuality Stuff funny stuff Lots of Stuff Thought dump Angst Fluff Hurt No Comfort good stuff bad stuff Death Self Harm Mental Illness Gender Dysphoria|
8,86,44482609,23 Jan 2023, say you'll live for me by Knight_of_Tartarus ,English,"63,885",29/29,8491,"| Not Rated| Rape/Non-Con, Choose Not To Use Archive Warnings| M/M, Multi| Complete Work|","|Rape/Non-Con Creator Chose Not To Use Archive WarningsSteve Harrington/Eddie Munson Robin Buckley & Steve Harrington Steve Harrington & The Party Steve Harrington & Maxine ""Max"" Mayfield Robin Buckley & Chrissy Cunningham & Steve Harrington & Eddie Munson Robin Buckley/Chrissy Cunningham Jonathan Byers/Nancy Wheeler Billy Hargrove/Steve Harrington Billy Hargrove & Maxine ""Max"" Mayfield Steve Harrington & Everyone Eddie Munson & The Party Steve Harrington & Eddie Munson & Wayne Munson Steve Harrington & Dustin HendersonSteve Harrington Steve Harrington's Parents Eddie Munson Wayne Munson Vecna (Stranger Things) Robin Buckley The Party (Stranger Things)Onesided Billy Hargrove/Steve Harrington Nightmares Stranger Things Spoilers Not Canon Compliant Inspired by Music Bisexual Steve Harrington Gay Eddie Munson Steve Harrington Needs a Hug Steve Harrington Has Bad Parents Steve Harrington Has Head Trauma Hurt Steve Harrington Steve Harrington is Not Okay Steve Harrington Has Nightmares Maxine ""Max"" Mayfield Needs a Hug Steve Harrington & Maxine ""Max"" Mayfield Have a Sibling Relationship Protective Maxine ""Max"" Mayfield Eddie Munson is a Sweetheart Suicide Attempt Suicidal Thoughts Protective Steve Harrington Protective Eddie Munson Self-Worth Issues Self-Hatred Vecna Possessing Steve Harrington Mental Health Issues POV Steve Harrington POV Eddie Munson POV Alternating POV Multiple Eating Disorders Somebody Lives/Not Everyone Dies Period-Typical Homophobia Major Character Injury Temporary Character Death Character Death this series will end on a happy note I promise!|"
9,86,42848958,23 Jan 2023, Patient 000 (Vol 1) by marvel_hiddles_2981 ,English,"22,260",5/?,607,"| Explicit| Graphic Depictions Of Violence, Major Character Death| F/M, Gen, Other| Work in Progress|","|Graphic Depictions Of Violence Major Character DeathHenry Creel | One | Vecna & Original Female Character(s) Henry Creel | One | Vecna & Original Character(s) Henry Creel | One | Vecna/Original Female Character(s) Eleven | Jane Hopper & Original Character(s) Henry Creel | One | Vecna/YouHenry Creel | One | Vecna Martin Brenner Two (Stranger Things) Eleven | Jane Hopper Sam Owens (Stranger Things) Original Experiment Character(s) (Stranger Things) Jim ""Chief"" Hopper Kali Prasad Alice Creel Virginia Creel Victor CreelHenry Creel | One | Vecna Needs a Hug Manipulative Henry Creel | One | Vecna Sub Henry Creel | One | Vecna Dom Henry Creel | One | Vecna Enemies to Friends to Lovers Slow Burn Fluff and Smut Angst and Fluff and Smut Implied/Referenced Dubious Consent Dom/sub Masochism Eventual Smut Eventual Romance Eleven | Jane Hopper Needs a Hug Psychic Abilities Psychic Violence Psychological Torture Implied/Referenced Torture Implied/Referenced Child Abuse Emotional Manipulation Alternate Universe - Canon Divergence Suicidal Thoughts Implied/Referenced Character Death Implied/Referenced Suicide Self-Harm Canon-Typical Violence Character Death Hawkins (Stranger Things) Hawkins National Laboratory (Stranger Things) Loss of Virginity Loss of Innocence Corruption Heavy Angst Cunnilingus Developing Relationship Young Love Secret Relationship Henry being cryptic Sorry in advance for inconsistent updates It Gets Worse Before It Gets Better Dacryphilia Shameless Smut Martin Brenner Being an Asshole Sexual Inexperience Touch-Starved Author hasn't decided on good or bad ending Slow Build Suicide Attempt Pregnancy trope BUT IT'S NOT WHAT YOU THINK I PROMISE varying chapter lengths im sorry Breeding Henry Creel | One | Vecna is His Own Warning Horny Teenagers|"
10,86,41631813,23 Jan 2023," Home, a Transitive Vol. 1 by percymunson2 ",English,"13,970",5/13,1868,"| Teen And Up Audiences| No Archive Warnings Apply| F/F, F/M, M/M| Work in Progress|","|No Archive Warnings ApplyMinor or Background Relationship(s) Robin Buckley/Nancy Wheeler Steve Harrington/Eddie Munson Eleven | Jane Hopper/Maxine ""Max"" Mayfield/Lucas Sinclair Amity Blight/Luz Noceda Will Byers & Eleven | Jane Hopper Will Byers & Luz Noceda Eda Clawthorne/Raine WhispersWill Byers Mike Wheeler Eleven | Jane Hopper Steve Harrington Robin Buckley Nancy Wheeler Eddie Munson Maxine ""Max"" Mayfield Lucas Sinclair Dustin Henderson Luz Noceda Amity Blight Willow Park Gus Porter Hunter | The Golden Guard (The Owl House) Eda Clawthorne King (The Owl House) Hooty (The Owl House) Mattholomule (The Owl House) Raine Whispers Philip Wittebane | Emperor BelosAlternate Universe - Canon Divergence Angst Fluff and Angst Crossover The Owl House Season 2 Post-Stranger Things 4 Vol. 2 Will Byers Has Powers Mike Wheeler Being an Asshole Alternate Universe - Everyone Lives/Nobody Dies Post-Episode: s02e10 Yesterday's Lie (The Owl House) poor will this kid cannot catch a break mike wheeler will not catch a break because he doesn’t deserve one Other Additional Tags to Be Added Will Byers-centric Will is so confused but so are we|"
11,86,44117320,23 Jan 2023, Step Away From the Netflix. by 1f_this_be_madness ,English,"8,938",7/12,901,"| General Audiences| Graphic Depictions Of Violence| Gen, F/M, M/M, F/F| Work in Progress|","|Graphic Depictions Of ViolenceDean Winchester & Sam Winchester Castiel & Dean Winchester & Sam Winchester Castiel & Dean Winchester Castiel & Sam Winchester Undisclosed Relationship(s)Dean Winchester Sam Winchester Castiel (Supernatural) Jack Kline Vecna (Stranger Things) The Party (Stranger Things) Steve Harrington Robin Buckley Eddie Munson Nancy Wheeler Jonathan Byers Joyce Byers Erica Sinclair Jim ""Chief"" Hopper Murray Bauman Argyle (Stranger Things)International Fanworks Day 2019 Television Watching Fluff in the Men of Letters Bunker (Supernatural) Hanging Out Friendship Banter Brotherly Affection Affectionate Insults Discovering the phenomenon Stranger Things (TV 2016) References And yes I am aware GOT isn't on Netflix But Dean bought the first two seasons in Season 9 so I'm going off that fact Sam Winchester is a tru-crime nerd i love it Swearing Stranger Things Spoilers Will Byers Deserves Love Will Byers Needs a Hug Dean Winchester is Good With Children If Scooby-Natural happened but with Stranger Things Inspired by Stranger Things (TV 2016) Brotherly Angst Hurt/Comfort No longer a one-shot Body Horror Blood and Violence Action/Adventure Implied/Referenced Character Death Game of Thrones References Mindhunter References Orange is the New Black References Heathers References Steve gets a break from babysitting Because Dean bout to do it Protective Dean Winchester The Dive and canon divergence thereafter Will deserves some understanding Also Cas and Erica gotta be sass-master besties I don't make the rules Actually in this case I do lol POV Dean Winchester POV Third Person Limited Angst Guilty Dean Winchester Angel Powers (Supernatural) Cas uses his angel powers and is an absolute badass Dean definitely finds it hot but we all know him Dean Winchester Needs to Use Actual Words|"
12,86,44471242,23 Jan 2023," I Try To Laugh About It, Hiding The Tears in My Eyes by odderstuff ",English,"6,008",1/1,1815,"| Explicit| Choose Not To Use Archive Warnings, No Archive Warnings Apply| M/M| Complete Work|",|Creator Chose Not To Use Archive Warnings No Archive Warnings ApplySteve Harrington/Eddie Munson Minor or Background Relationship(s)Steve Harrington Eddie Munson Robin BuckleySmut Angst It's so Angsty I'm so Sorry Blow Jobs First Time Blow Jobs Steve Harrington Needs a Hug Steve Harrington Has Bad Parents Sad Steve Harrington Eddie Munson Lives Eddie Munson is a Sweetheart Morning Sex Morning Cuddles Soft Dom Eddie Munson Sub Steve Harrington Light Dom/sub Kink Negotiation Finally! Self-Esteem Issues Steve thinks everybody hates him bc he's sad Miscommunication My beta is grammarly and we are NOT friends Steve Harrington Has a Praise Kink Steve Harrington Has a Crush on Eddie Munson Eddie Munson Has a Crush on Steve Harrington Actually more than a crush that boy is in love Masochist Steve Harrington Light Masochism Light Sadism Hair-pulling Making Out Kissing Boys Kissing Steve Harrington is Bad at Feelings Flirting|
13,86,44480842,23 Jan 2023, A Daffodil’s Rage by RogueAriadne ,English,"122,657",21/?,1042,| Mature| Choose Not To Use Archive Warnings| No category| Work in Progress|,"|Creator Chose Not To Use Archive WarningsOriginal Characters Original Female Character(s) Original Male Character(s) Dustin Henderson Claudia Henderson Eleven | Jane Hopper Jim ""Chief"" Hopper Nancy Wheeler Eddie Munson Steve Harrington Billy Hargrove Maxine ""Max"" Mayfield Lucas Sinclair Mike Wheeler Will Byers Joyce Byers Wayne MunsonAlternate Timelines supernatural elements other than Stranger Things stuff Familiars Magic Angst Hurt/Comfort Blood Temporary Character Death Everyone Lives (kinda) Minor Character Death Suicidal Ideation mental and physical abuse PTSD Trauma time jump from 2021 to 1983 Fix-It Alternate Universe - Canon Divergence plant-based magic Dungeons and Dragons mentions of dungeons and dragons Druid references Accidental Time Travel Eddie Munson is a Sweetheart Billy Hargrove Redemption Billy Hargrove Tries to Be a Better Person|"
14,86,44084046,23 Jan 2023, Roll for Seduction by CelestialVoid ,English,"2,565",1/1,2072,| Explicit| No Archive Warnings Apply| M/M| Complete Work|,|No Archive Warnings ApplySteve Harrington/Eddie Munson Steve Harrington & Dustin HendersonSteve Harrington Eddie Munson Dustin Henderson Mike Wheeler Hellfire Club (Stranger Things)Smut Fluff and Smut Shameless Smut Gratuitous Smut Plot What Plot/Porn Without Plot Bisexual Steve Harrington Gay Eddie Munson Eddie Munson Has a Crush on Steve Harrington Steve Harrington Has a Crush on Eddie Munson Dungeons & Dragons References Characters Play Dungeons & Dragons No Dungeons & Dragons Knowledge Required Hellfire Club Kissing Boys Kissing Rough Kissing Neck Kissing Surprise Kissing Biting Hair-pulling Long Hair Making Out Steve Harrington Has a Pain Kink Steve Harrington Has a Hair-Pulling Kink Eddie Munson Has a Big Dick Blow Jobs Oral Sex Clothed Sex Come Swallowing Semi-Public Sex Babysitter Steve Harrington Good Babysitter Steve Harrington Steve Harrington & Dustin Henderson Friendship|
15,86,43204819,23 Jan 2023, let us adore you by fbfh (cheweduphoodiestring) ,English,"1,011",1/2,131,"| Mature| No Archive Warnings Apply| F/F, F/M, Multi| Work in Progress|",|No Archive Warnings ApplyRobin Buckley/Reader Steve Harrington/Reader Billy Hargrove/ReaderSteve Harrington Billy Hargrove Robin Buckley ReaderFluff Domestic Fluff Emotional Hurt/Comfort Gender-Neutral Pronouns Fluff and Crack Headcanon Mental Health Issues Guilt Emotional Baggage Two Shot Aged-Up Character(s)|
16,86,44395348,23 Jan 2023, dying wish by madwickedawesome ,English,"6,247",1/3,176,| General Audiences| No Archive Warnings Apply| F/F| Work in Progress|,"|No Archive Warnings ApplyEleven | Jane Hopper/Maxine ""Max"" Mayfield Maxine ""Max"" Mayfield & Mike Wheeler Will Byers & Maxine ""Max"" MayfieldEleven | Jane Hopper Maxine ""Max"" Mayfield Lucas Sinclair Mike Wheeler Will Byers Jim ""Chief"" Hopper Joyce ByersMemory Loss Alternate Universe - Canon Divergence Angst Fluff I love them so much Post-Episode: s04e09 The Piggyback (Stranger Things) Lesbian Eleven | Jane Hopper byler if u squint hard enjoy pls shout out 2 Jaymen for being on call when i wrote this|"
17,86,44415454,23 Jan 2023, Byler smut by Byl3rs___h3artt ,English,"1,337",1/?,548,| Mature| No Archive Warnings Apply| M/M| Work in Progress|,|No Archive Warnings ApplyMike Wheeler Will ByersOmorashi Smut|
18,86,41417448,23 Jan 2023, he a-a-ate my heart by savewillie ,English,"17,535",1/1,984,| Teen And Up Audiences| No Archive Warnings Apply| M/M| Complete Work|,"|No Archive Warnings ApplyWill Byers/Mike WheelerWill Byers Mike Wheeler Dustin Henderson Lucas Sinclair Maxine ""Max"" Mayfield Eleven | Jane HopperAlternate Universe - Modern Setting Werewolves Alternate Universe - Werewolf Mike as a werewolf will as a dennys worker Mike Wheeler is a CringeFail Loser Mike Wheeler is a Sweetheart elmax - Freeform henclair Making Out NOT BETA READ OMG praying its okay was listening to monster by lady gaga on repeat will has shitty shitty questionable taste in men 17k of pure shit Attempt at Humor Fluff no plot honestly Fluff and Crack Crack|"
19,86,41611518,23 Jan 2023, A Pack Of Two by Lemmerman ,English,"138,088",32/32,4929,| Mature| No Archive Warnings Apply| M/M| Complete Work|,|No Archive Warnings ApplySteve Harrington/Eddie MunsonSteve Harrington Eddie Munson Robin Buckley Nancy Wheeler Wayne MunsonWerewolves Blowjobs Rated M For Sex Sexual Content Semi-Public Sex Internalized Homophobia Emotional/Psychological Abuse Coming Out Recreational Drug Use Body Image|
20,87,44478850,23 Jan 2023," Out of Touch, Out of Reach by tuttifruitti ",English,"5,895",3/?,528,| Explicit| No Archive Warnings Apply| M/M| Work in Progress|,|No Archive Warnings ApplySteve Harrington/Eddie Munson Minor or Background Relationship(s)Steve Harrington Eddie Munson Robin Buckley Chrissy Cunningham Nancy Wheeler Jonathan ByersAlternate Universe - Modern Setting Alternate Universe - College/University Enemies to Lovers Enemies to Friends to Lovers on eddies side at least Slow Burn Steve Harrington is a flirt Eddie Munson is Bad at Feelings Minor Jonathan Byers/Nancy Wheeler Minor Robin Buckley/Chrissy Cunningham Eventual Smut Top Eddie Munson Bottom Steve Harrington But also Bottom Eddie Munson Top Steve Harrington Getting Together Not Beta Read|
21,87,41589507,23 Jan 2023, Run with the Wolf by Splintercat ,English,"20,399",12/?,1312,| Mature| Graphic Depictions Of Violence| M/M| Work in Progress|,"|Graphic Depictions Of ViolenceBilly Hargrove/Steve Harrington/Eddie Munson Clayton Danvers/Nick Sorrentino Billy Hargrove/Eddie Munson Billy Hargrove/Steve Harrington Steve Harrington/Eddie MunsonEddie Munson Steve Harrington Billy Hargrove Dustin Henderson Robin Buckley Clayton Danvers Nick Sorrentino Jeremy Danvers Daniel Santos Malcolm Danvers Original Male Character(s) Maxine ""Max"" Mayfield Susan HargroveOther Additional Tags to Be Added Ensemble Cast Alternate Universe - Werewolf No Russians in Hawkins (Stranger Things) Starcourt Mall (Stranger Things) Starcourt Mall is Not Destroyed (Stranger Things) Scoops Ahoy (Stranger Things) Slow Burn Eddie Munson Lives Billy Hargrove Lives Werewolf Eddie Munson Werewolf Dustin Henderson Werewolf Billy Hargrove Gay Eddie Munson Bisexual Steve Harrington Billy Hargrove Redemption Billy Hargrove Tries Hurt Billy Hargrove Werewolf Turning Canonical Child Abuse Torture Broken Bones Blood and Injury Minor Character Death Cannibalism references to past dismemberment References to Past Mutilation Tags May Change Rating May Change Animal Death Angst with a Happy Ending It Gets Worse Before It Gets Better Body Horror Parent Death Victim Blaming Grief/Mourning Suicidal Thoughts Self-Hatred Slurs Billy Hargrove Needs a Hug Billy Hargrove Deserves Better Period-Typical Homophobia Homophobic Language Billy Hargrove Needs Love|"
22,87,44315149,23 Jan 2023, The Boathouse by Lia_Jane ,English,"31,939",7/?,3032,| Explicit| No Archive Warnings Apply| M/M| Work in Progress|,"|No Archive Warnings ApplySteve Harrington/Eddie MunsonSteve Harrington Eddie Munson Dustin Henderson Maxine ""Max"" Mayfield Lucas Sinclair Mike Wheeler Nancy Wheeler Robin BuckleyShameless Smut Emotional Hurt/Comfort Gay Eddie Munson Stranger Things 4 Bisexual Steve Harrington Angst Canonical Character Death Top Steve Harrington Bottom Eddie Munson Anal Sex Explicit Sexual Content Anal Fingering Rough Sex Bottom Steve Harrington Top Eddie Munson|"
23,87,44480143,23 Jan 2023, Arachnology Applied by Fluffy_Earthworm ,English,"2,890",1/?,35,| Mature| Graphic Depictions Of Violence| No category| Work in Progress|,|Graphic Depictions Of ViolenceHenry Creel | One | Vecna Martin Brenner Doctor EllisImplied/Referenced Drug Use Abuse Torture Imprisonment Just the usual protocol for unethical government experiments Spiders Like lots of spider references Seriously there be spiders Probably not for arachnophobics Author is a spider apologist Henry is too Dreams Lucid Dreaming Other Additional Tags to Be Added|
24,87,43530768,23 Jan 2023," this love came back to me by strawberryspence  for hexiewrites, silversfiction ",English,"15,968",2/2,3370,| Teen And Up Audiences| Choose Not To Use Archive Warnings| M/M| Complete Work|,|Creator Chose Not To Use Archive WarningsSteve Harrington/Eddie Munson Robin Buckley & Steve Harrington Steve Harrington & The PartySteve Harrington Eddie Munson Robin Buckley Dustin Henderson The Party (Stranger Things) Corroded Coffin (Stranger Things)Robin Buckley & Steve Harrington Are Best Friends Background Relationships Temporary Character Death Eddie is dead most of the fic But he is alive Steve Harrington is Famous Singer Steve Harrington Teacher Eddie Munson Alternate Universe - Everyone Lives/Nobody Dies Post-Canon Fix-It Angst with a Happy Ending Steve Harrington Needs a Hug Found Family Aged-Up Character(s) Flashbacks Non-Linear Narrative|
