,Index_page,ID,Date_publication,Title_and_author,Language_of_the_work,Word,Chapter,Hits,Requiered_tags,Additionnal_tags
290,100,44438989,21 Jan 2023, The other shoe by F0xface3 ,English,"6,223",2/2,945,| General Audiences| No Archive Warnings Apply| F/M| Complete Work|,|No Archive Warnings ApplyChrissy Cunningham/Eddie Munson Eddie Munson & Wayne Munson Chrissy Cunningham & Wayne MunsonWayne Munson Eddie Munson Chrissy CunninghamAngst lil bit of a character study and a very different Wayne than I usually write|
291,100,44314189,21 Jan 2023, a rare and gentle thing by yournowheregirl ,English,"16,387",6/6,1543,| Teen And Up Audiences| No Archive Warnings Apply| M/M| Complete Work|,|No Archive Warnings ApplySteve Harrington/Eddie MunsonEddie Munson Steve Harrington Wayne Munson Robin Buckley Nancy Wheeler Original Female Character(s) The Party (Stranger Things) Dustin Henderson Mike WheelerAlternate Universe - Everyone Lives/Nobody Dies Southern Eddie Munson Not Actually Unrequited Love Dolly Parton songs as a coping mechanism Gay Eddie Munson Bisexual Steve Harrington Eddie Munson Has a Crush on Steve Harrington Appalachian Eddie Munson Crushes Found Family|
292,100,44437969,21 Jan 2023, We Get High (Steddie Version) by HawkinsHighDropout ,English,"2,180",1/1,348,| General Audiences| Choose Not To Use Archive Warnings| M/M| Complete Work|,|Creator Chose Not To Use Archive WarningsSteve Harrington/Eddie MunsonEddie Munson Steve Harrington Wayne MunsonEddie Munson Lives Eddie Munson is a Sweetheart Gay Eddie Munson Steve Harrington is a Sweetheart Bisexual Steve Harrington Robin Buckley & Steve Harrington Are Best Friends Alternate Universe - Canon Divergence Established Relationship Supportive Wayne Munson Eddie lets Steve try weed as he's not smoked in years Soft Eddie Munson Soft Steve Harrington|
293,100,44241106,21 Jan 2023, We Get High. by HawkinsHighDropout ,English,"1,240",1/1,264,| General Audiences| Choose Not To Use Archive Warnings| F/M| Complete Work|,|Creator Chose Not To Use Archive WarningsEddie Munson/You Eddie Munson & Original Female Character(s) Eddie Munson/ReaderEddie Munson ReaderEddie Munson Lives Eddie Munson is a Sweetheart Reader-Insert Alternate Universe - Canon Divergence|
294,100,42279891,21 Jan 2023, Breaking The Mold by CrystalDragonette ,English,"2,855",2/?,1984,"| General Audiences| Choose Not To Use Archive Warnings, No Archive Warnings Apply| F/M, M/M| Work in Progress|","|Creator Chose Not To Use Archive Warnings No Archive Warnings ApplySteve Harrington/Eddie Munson Jonathan Byers/Nancy Wheeler Eddie Munson & Wayne Munson Steve Harrington & Wayne MunsonSteve Harrington Eddie Munson Wayne Munson Nancy Wheeler Jonathan Byers Joyce Byers Jim ""Chief"" Hopper Mike Wheeler Eleven | Jane Hopper Dustin Henderson Lucas Sinclair Erica Sinclair Robin Buckley Will Byers Gareth (Stranger Things) Jeff (Stranger Things) Unnamed Freak (Stranger Things)Hurt/Comfort Angst Fluff Hurt Steve Harrington Punk Steve Harrington Body Horror Blood and Injury Eye Trauma Protective Eddie Munson Soft Eddie Munson Past Relationship(s) Gareth & Eddie Munson Are Best Friends Supportive Eddie Munson Supportive Party (Stranger Things) Gareth is a Little Shit Eddie Munson knows about the Upside Down|"
295,100,43848150,21 Jan 2023, Monsters from another dimension are stranger things than heroes from the future by mysoul_is_alwayswithyou ,English,"4,328",3/3,69,"| Not Rated| Graphic Depictions Of Violence| F/F, Gen, M/M| Complete Work|","|Graphic Depictions Of ViolenceJirou Kyouka/Yaoyorozu Momo Uraraka Ochako & Yaoyorozu Momo Kendou Itsuka & Yaoyorozu Momo Kendou Itsuka & Uraraka OchakoKendou Itsuka Yaoyorozu Momo Uraraka Ochako Henry Castafolte Dustin Henderson Henry Creel | One | Vecna Mike Wheeler Will Byers Eleven | Jane Hopper Lucas Sinclair Maxine ""Max"" Mayfield Chrissy Cunningham Eddie Munson Jason Carver Jonathan Byers Nancy Wheeler Robin Buckley Steve Harrington Wayne Munson Le Visiteur | The Visitor (Le Visiteur du Futur) Raph (Le Visiteur du Futur) Alice AlibertAngst with a Happy Ending Unrequited Love Time Travel Fix-It|"
296,100,44435557,21 Jan 2023, Rust In Their Eyes by nerdsandthelike  for laleia ,English,"10,413",2/2,43,| Teen And Up Audiences| No Archive Warnings Apply| F/F| Complete Work|,|No Archive Warnings ApplyRobin Buckley/Kali Prasad Minor or Background Relationship(s)Robin Buckley Kali PrasadMinor Jonathan Byers/Steve Harrington/Nancy Wheeler non-endgame Robin Buckley/Kali Prasad Future Fic College-Age POV Alternating the narrators are really in their own heads Insecurity Angst Getting Together Developing Relationship Break Up Bittersweet Ending Found Family Running away from your problems your problems catching up to you Smoking Additional Warnings In Author's Note|
297,100,44438887,21 Jan 2023, Even the devil had his owns demons to mourn him by dawnjohnson43 ,English,"48,321",12/?,448,"| Teen And Up Audiences| Choose Not To Use Archive Warnings| F/F, F/M, Gen, M/M, Multi| Work in Progress|","|Creator Chose Not To Use Archive WarningsWill Byers/Mike Wheeler Will Byers/Original Male Character(s) Lucas Sinclair/Original Male Character(s) Robin Buckley/Nancy Wheeler (background) Argyle/Jonathan Byers/Steve Harrington (Background) Eleven | Jane Hopper/Maxine ""Max"" Mayfield Eleven | Jane Hopper/Original Female Character(s) Mike Wheeler/Original Male Character(s) Suzie Bingham/Dustin Henderson (Former)Will Byers Mike Wheeler Lucas Sinclair Erica Sinclair Dustin Henderson Maxine ""Max"" Mayfield Eleven | Jane Hopper Jonathan Byers Jim ""Chief"" Hopper Joyce Byers Argyle (Stranger Things) Steve Harrington Robin Buckley Nancy Wheeler Holly Wheeler Lucas Sinclair's Parents Murray Bauman Dmitri Antonov Original Experiment Character(s) (Stranger Things) Original male character (s) Original Female Character(s)Post-Season/Series 04 High School Breaking Up & Making Up Implied/Referenced Cheating Not Cheating Implied Sexual Content Implied/Referenced Child Abuse Implied/Referenced Suicide Song: Vigilante Shit (Taylor Swift) The Party as Family (Stranger Things) Will Byers Has Powers Step-Siblings Will Byers & Eleven | Jane Hopper Open Relationships Period-Typical Racism Period-Typical Homophobia Flirting|"
298,100,44059636,21 Jan 2023, Status Effects by Magneeterandwheels ,English,"30,077",9/?,1634,"| Mature| Graphic Depictions Of Violence| F/F, F/M, M/M, Multi| Work in Progress|","|Graphic Depictions Of ViolenceSteve Harrington/Eddie Munson Robin Buckley/Vicki Carmichael Eleven | Jane Hopper/Mike Wheeler Maxine ""Max"" Mayfield/Lucas Sinclair Jonathan Byers/Nancy Wheeler Joyce Byers/Jim ""Chief"" Hopper Suzie Bingham/Dustin HendersonSteve Harrington Eddie Munson Robin Buckley Eleven | Jane Hopper Mike Wheeler Lucas Sinclair Maxine ""Max"" Mayfield Will Byers Dustin Henderson Suzie Bingham Original Characterssteddie Bisexual Steve Harrington Gay Eddie Munson Mpreg Past Mpreg Post Season 4 Hawkins (Stranger Things) Original Character(s) Original villain - Freeform Bottom Steve Harrington Top Eddie Munson Sequel Eddie Munson Lives Eddie Munson is a Sweetheart Eddie Munson is a Good Dad Actual mom Steve Harrington Protective Steve Harrington Protective Eddie Munson|"
299,100,42458490,21 Jan 2023, Второй раунд / Round two by LenaSuperbee  for hoppnhorn ,Русский,"22,185",8/8,52,| Explicit| Choose Not To Use Archive Warnings| M/M| Complete Work|,|Creator Chose Not To Use Archive WarningsBilly Hargrove/Steve Harrington|
300,101,44043780,21 Jan 2023, wait for the season to come back to me by laundrybiscuits ,English,"10,263",3/?,1291,| Teen And Up Audiences| No Archive Warnings Apply| M/M| Work in Progress|,|No Archive Warnings ApplySteve Harrington/Eddie MunsonSteve Harrington Eddie Munson Robin BuckleyTemporary Character Death Vampire Eddie Munson Eddie Munson Lives Future Fic Angst with a Happy Ending Brief and nonromantic Steve/OMC Bisexual Steve Harrington Gay Eddie Munson|
301,101,44435206,21 Jan 2023, Seek the Bat by CorrodedEnder ,English,360,1/3,195,| General Audiences| No Archive Warnings Apply| No category| Work in Progress|,"|No Archive Warnings ApplyMinor or Background Relationship(s) Steve Harrington/Eddie Munson Robin Buckley/Nancy Wheeler Joyce Byers/Jim ""Chief"" Hopper Joyce Byers & Eddie Munson Jim ""Chief"" Hopper & Eddie Munson Eleven | Jane Hopper & Eddie MunsonEddie Munson Steve Harrington Robin Buckley Nancy Wheeler Joyce Byers Jim ""Chief"" Hopper Dustin Henderson Lucas Sinclair Maxine ""Max"" Mayfield Mike Wheeler Eleven | Jane Hopper Will Byers Jonathan Byers Argyle (Stranger Things)Bat Eddie Munson Autistic Eddie Munson Gay Eddie Munson Eddie Munson Lives Vampire Eddie Munson No Smut Fluff Tooth-Rotting Fluff Fluff and Crack Eddie Munson is a Sweetheart Eddie Munson is a Little Shit|"
302,101,44123655,21 Jan 2023, And they lived happily ever after by Cherilady ,English,"5,338",7/?,106,"| Teen And Up Audiences| No Archive Warnings Apply| F/M, M/M| Work in Progress|","|No Archive Warnings ApplyAlexei/Murray Bauman Joyce Byers & Jim ""Chief"" HopperJim ""Chief"" Hopper Joyce Byers Murray Bauman Alexei (Stranger Things)Kissing Fluff Injury Recovery Angst with a Happy Ending Angst and Hurt/Comfort Romantic Friendship|"
303,101,44137350,21 Jan 2023," Rocky Horror Hawkins: One Shots by Cynic_Rose, MiniMusings ",English,"111,810",23/?,1125,"| Mature| Choose Not To Use Archive Warnings| F/M, F/F, M/M, Multi| Work in Progress|","|Creator Chose Not To Use Archive WarningsJonathan Byers/Nancy Wheeler Argyle/Billy Hargrove Argyle/Eden Bingham Steve Harrington/Eddie Munson Jonathan Byers/Chrissy Cunningham/Eddie Munson Jonathan Byers/Eddie Munson Billy Hargrove/Vance Hopper Chrissy Cunningham/Nancy Wheeler Billy Hargrove/Steve Harrington Vance Hopper/Eddie Munson Barbara ""Barb"" Holland/Nancy Wheeler Billy Hargrove/Steve Harrington/Nancy Wheeler Steve Harrington/Vance Hopper Steve Harrington/Billy Hargrove/Eden Bingham/Argyle Argyle/Billy Hargrove/Steve Harrington Argyle/Billy Hargrove/Eden Bingham/Steve HarringtonNancy Wheeler Jonathan Byers Robin Buckley Chrissy Cunningham Argyle (Stranger Things) Eden Bingham Billy Hargrove Steve Harrington Eddie Munson Vance Hopper Barbara ""Barb"" HollandFirst Time Minor blood warning romantic sex Oral Sex Vaginal Sex Cunnilingus 69 (Sex Position) Accidental Voyeurism Threesomes Healthy Communication Supportive girlfriends/boyfriends Cuddling Aftercare Wrestling Semi-Public Sex Anal Sex Scent Kink|"
304,101,43537935,21 Jan 2023, Eddie's Little Sister by Motherofmoggies ,English,"39,988",16/?,1833,"| Teen And Up Audiences| No Archive Warnings Apply, Graphic Depictions Of Violence| No category| Work in Progress|",|No Archive Warnings Apply Graphic Depictions Of ViolenceEddie Munson & SisterEddie Munson Wayne Munson Robin Buckley Stacey Albright Chrissy Cunningham Chrissy Cunningham's Brother Bob Newby Dustin Henderson Mike Wheeler Lucas Sinclair Erica Sinclair Will Byers Mr. Clarke Pippin the CatLord (OC) Mrs. Sinclaireddie munson is a big brother Eddie Munson Needs a Hug Eddie Munson is a Sweetheart Hurt/Comfort Autistic Eddie Munson Autistic OC Swearing Panic Attacks Sensory Overload Implied/Referenced Alcohol Abuse/Alcoholism Spoilers Illnesses Autistic Robin Buckley Childhood trauma (including death) Abandonment Foster Care Implied/Referenced Child Abuse Bullying Angst Smoking THIS IS MUSIC! tics Asthma Allergies Implied/Referenced Drug Use Graphic depiction of death Car Accidents Vomiting Dissociation Post-Traumatic Stress Disorder - PTSD Attempted Kidnapping Substance Abuse Stranger Things Season 1 Spoilers|
305,101,43315095,21 Jan 2023, Stop being so cute by ChaosDweller ,English,720,1/1,847,| General Audiences| No Archive Warnings Apply| M/M| Complete Work|,|No Archive Warnings ApplySteve Harrington/Eddie MunsonSteve Harrington Eddie MunsonEstablished Relationship Sleepy Cuddles Banter Fluff Humor Not Beta Read|
306,101,44434201,21 Jan 2023, movie morning .. by wildwheeler ,English,551,1/1,212,| Not Rated| No Archive Warnings Apply| M/M| Complete Work|,|No Archive Warnings ApplyWill Byers/Lucas Sinclair Joyce Byers & Will Byers Dustin Henderson & Lucas SinclairLucas Sinclair Will Byers Joyce Byers Dustin Hendersonlucas sinclair and will byers joyce being the supportive mom she is dustin being a cute asshole to lucas will byers housewife era kind-of future fic lucas sinclair is a cutie once again they are absolute cutie patooties i want to squish them|
307,101,44196772,21 Jan 2023, Natural 20 by EchoingHeart ,English,"185,967",33/?,11665,| Explicit| Graphic Depictions Of Violence| F/M| Work in Progress|,"|Graphic Depictions Of ViolenceEddie Munson/Original Female Character(s)Eddie Munson Steve Harrington Robin Buckley Dustin Henderson Lucas Sinclair Mike Wheeler Nancy Wheeler Andy (Stranger Things) Jason Carver Demo-Dogs (Stranger Things) Eleven | Jane HopperRecreational Drug Use Superpowers Friends to Lovers Slow Burn Romance Pre-Canon Eventual Canon Humor Fluff Angst Brenner mentions lab kid oc is 18 Nightmares Graphic Description Good Parent Jim ""Chief"" Hopper Broken Bones Healing Strength dnd Mutual Pining Idiots in Love Underage Drinking long fic First Kiss First Dates Implied/Referenced Homophobia Bisexuality First Sexual Experience Dry Humping First Orgasm Trust Fights Bullying Sam has no patience Accidental Superhero Human Experimentation Child Abuse Cunnilingus Protective Steve Harrington Platonic Female/Male Relationships Best Friends Neurodiversity Neurodivergent Robin Buckley Neurodivergent Eddie Munson Light BDSM Light Dom/sub Switching Switch Eddie Munson Blow Jobs Sexual Experimentation First Time Loss of Virginity|"
308,101,44360368,21 Jan 2023, Quick Breaths (It'll End Soon) by Sugarsprinkledbiscuits ,English,"2,135",1/1,903,| Mature| Choose Not To Use Archive Warnings| M/M| Complete Work|,"|Creator Chose Not To Use Archive WarningsSteve Harrington/Eddie MunsonSteve Harrington Eddie Munson Wayne Munson Dustin Henderson Robin Buckley Maxine ""Max"" Mayfieldsteddie Steve Harrington Needs a Hug Mental Health Issues References to Depression Steve Harrington Has OCD Implied/Referenced Suicide Implied/Referenced Self-Harm Nobody Dies Angst with a happy ending?|"
309,101,40277046,21 Jan 2023, Stranger Things Smut by AkumunoHana ,English,"9,574",2/?,542,"| Mature| Choose Not To Use Archive Warnings| F/M, Multi| Work in Progress|",|Creator Chose Not To Use Archive WarningsEddie Munson/Original Female Character(s) Eddie Munson/You Eddie Munson & Reader Billy Hargrove/Original Female Character(s) Billy Hargrove/You Billy Hargrove/Reader Steve Harrington/Original Female Character(s) Steve Harrington/You Steve Harrington/ReaderEddie Munson Steve Harrington Billy Hargrove Original Female Character(s) Robin Buckley Nancy Wheeler Jonathan ByersSmut Fluff Angst Fluff and Angst Fluff and Smut Domestic Boyfriends|
310,101,44228800,21 Jan 2023, What’s wrong with mike by Littlefucker ,English,"1,497",4/4,433,| Not Rated| Choose Not To Use Archive Warnings| M/M| Complete Work|,|Creator Chose Not To Use Archive WarningsWill Byers/Mike Wheeler|
311,101,44433346,21 Jan 2023," 5 times Mike and Will try to have their first kiss, +1 time they finally do by nikolai_vincent ",English,"11,161",6/6,1164,| General Audiences| No Archive Warnings Apply| M/M| Complete Work|,"|No Archive Warnings ApplyWill Byers/Mike WheelerWill Byers Mike Wheeler Lucas Sinclair Dustin Henderson Maxine ""Max"" Mayfield Eleven | Jane Hopper Small Mention of Nancy Wheeler Joyce ByersFluff First Kiss 5+1 Things Mike Wheeler Loves Will Byers Will Byers Loves Mike Wheeler No Angst Interruption Mike and Will are dating They're just too embarrassed to kiss They're getting there Alternate Universe - No Upside Down (Stranger Things) mike and eleven never dated Gay Mike Wheeler Gay Will Byers They're awkward But We Love That Supportive Karen Wheeler|"
312,101,41970120,21 Jan 2023, a feeling so peculiar by persephoneslibrary ,English,"22,447",5/?,1952,| Mature| No Archive Warnings Apply| F/F| Work in Progress|,"|No Archive Warnings ApplyRobin Buckley/Nancy WheelerRobin Buckley Nancy Wheeler Maxine ""Max"" Mayfield Chrissy Cunningham Joyce Byers Jonathan Byers Will Byersgroup home au Dysfunctional Family Found Family Disabled Maxine ""Max"" Mayfield mentions of an eating disorder (side character) definite trigger warning Past Attempted Rape/Non-Con Protective Nancy Wheeler Past Child Abuse robin has been through so much but she's still a cocky piece of shit sort of enemies to lovers? dislike each other to lovers|"
313,101,43227337,21 Jan 2023, Midnight (Belongs to You and Me) by Polkadotdotdot ,English,"19,700",3/?,1244,"| Explicit| Choose Not To Use Archive Warnings| F/M, M/M| Work in Progress|","|Creator Chose Not To Use Archive WarningsChrissy Cunningham/Eddie Munson Minor or Background Relationship(s) Minor Billy Hargrove/Steve Harrington - Relationship Chrissy Cunningham & Billy HargroveEddie Munson Chrissy Cunningham Steve Harrington Nancy Wheeler Robin Buckley Dustin Henderson Maxine ""Max"" Mayfield Lucas Sinclair Jason Carver Mike Wheeler Billy HargroveNon-Linear Narrative Prompt Fill Romance Drama Romantic Comedy Smut Fluff One Shot Collection Oral Sex Eddie Munson Lives Chrissy Cunningham Lives Eddie Munson Has a Crush on Chrissy Cunningham Chrissy Cunningham Has a Crush on Eddie Munson Recreational Drug Use Smoking Outdoor Sex To Be Continued Protective Eddie Munson Drink Spiking Quickies Anal Fingering Anal Sex Pegging Gay Billy Hargrove Billy the Fairy Dom Mother Chrissy Cunningham & Billy Hargrove Friendship|"
314,101,44147658,21 Jan 2023, the voices are getting louder by iknowwhatyouaremike ,English,"1,669",1/1,621,"| Not Rated| No Archive Warnings Apply| M/M, Multi| Complete Work|","|No Archive Warnings ApplyWill Byers/Mike Wheeler Eleven | Jane Hopper/Maxine ""Max"" Mayfield Maxine ""Max"" Mayfield/Lucas Sinclair Suzie Bingham/Dustin Henderson Robin Buckley/Nancy WheelerMike Wheeler Will Byers Eleven | Jane Hopper Maxine ""Max"" Mayfield Lucas Sinclair Robin Buckley Dustin Henderson Nancy WheelerChatting & Messaging Mike Wheeler Loves Will Byers Gay Disaster Mike Wheeler Everyone Is Gay Polyamory Bisexual Maxine ""Max"" Mayfield Bisexual Lucas Sinclair Sapphic Eleven | Jane Hopper Mike Wheeler Has ADHD Autistic Will Byers Autistic Eleven | Jane Hopper|"
315,101,44433874,21 Jan 2023, waking the witch by arkenfinity ,English,"14,022",2/9,132,| Teen And Up Audiences| Choose Not To Use Archive Warnings| M/M| Work in Progress|,"|Creator Chose Not To Use Archive WarningsSteve Harrington/Eddie Munson Minor or Background Relationship(s)Eddie Munson Steve Harrington Eleven | Jane Hopper Robin Buckley Dustin Henderson Nancy Wheeler Jonathan Byers Argyle (Stranger Things) Maxine ""Max"" Mayfield Lucas Sinclair Erica Sinclair Will Byers Mike Wheeler Joyce Byers Jim ""Chief"" HopperKas!Eddie kind of? my take on it at least Post-Season/Series 04 Eddie and Eleven are besties|"
316,101,43510744,21 Jan 2023, companion pieces by twoofh34rts ,English,"2,353",2/?,257,| General Audiences| Choose Not To Use Archive Warnings| No category| Work in Progress|,|Creator Chose Not To Use Archive WarningsEddie Munson/Reader Eddie Munson/YouEddie Munson|
317,101,41750874,21 Jan 2023, all that's left behind by parx103 ,English,"22,881",15/15,1996,"| Teen And Up Audiences| Graphic Depictions Of Violence, Major Character Death| F/F, M/M| Complete Work|","|Graphic Depictions Of Violence Major Character DeathRobin Buckley/Nancy Wheeler Steve Harrington/Eddie Munson Will Byers/Mike Wheeler Eleven | Jane Hopper/Maxine ""Max"" MayfieldNancy Wheeler Robin Buckley Steve Harrington Maxine ""Max"" Mayfield Eddie Munson Will Byers Mike Wheeler Billy Hargrove Lucas Sinclair Dustin Henderson Eleven | Jane Hopper Karen Wheeler Jim ""Chief"" Hopper Murray Bauman Joyce ByersZombie Apocalypse Alternate Universe - Zombie Apocalypse Hurt/Comfort Emotional Hurt/Comfort Angst and Hurt/Comfort Character Death Past Character Death Ronancetober Strangers to Lovers Friends to Lovers|"
318,101,44445028,21 Jan 2023, I Don't Know Where We Are (But It Will Be OK) by ceewantstowrite ,English,"3,336",4/?,144,"| Teen And Up Audiences| Choose Not To Use Archive Warnings, No Archive Warnings Apply, Graphic Depictions Of Violence| F/M| Work in Progress|",|Creator Chose Not To Use Archive Warnings No Archive Warnings Apply Graphic Depictions Of ViolenceJamie Campbell Bower & Reader Jamie Campbell Bower/Original Character(s)Jamie Campbell Bower Joseph Quinn (Actor) Original Female Character(s) Original Male Character(s)Hurt/Comfort Fluff and Hurt/Comfort Trauma Angst and Feels Domestic Violence Mental Health Issues|
319,101,44043262,21 Jan 2023, growing up (but not old) by veraity ,English,"7,035",3/?,1894,"| Teen And Up Audiences| Choose Not To Use Archive Warnings| F/M, M/M| Work in Progress|",|Creator Chose Not To Use Archive WarningsWill Byers/Mike Wheeler Will Byers & Eleven | Jane Hopper Will Byers & Dustin Henderson & Lucas Sinclair & Mike WheelerWill Byers Mike Wheeler Dustin Henderson Lucas Sinclair Eleven | Jane Hopper Nancy Wheeler Jonathan Byers Joyce Byers Karen Wheeler Eddie Munson Steve Harrington Robin BuckleyTime Travel Alternate Universe - Canon Divergence Alternate Universe - Time Travel Time Travel Fix-It Gay Will Byers Mike Wheeler Loves Will Byers Will Byers Needs a Hug Will Byers Has Powers Mike Wheeler Being an Idiot writing this instead of doing my macbeth hw - Freeform I Wrote This Instead of Sleeping Eventual Romance Eventual Relationships|
320,102,44430469,21 Jan 2023, New Student by shelbyshub ,English,"1,030",3/3,508,| Not Rated| Choose Not To Use Archive Warnings| Other| Complete Work|,"|Creator Chose Not To Use Archive WarningsWednesday Addams/Xavier Thorpe Will Byers/Mike Wheeler Joyce Byers & Eleven | Jane Hopper Eleven | Jane Hopper & Jim ""Chief"" Hopper Joyce Byers/Jim ""Chief"" Hopper Maxine ""Max"" Mayfield/Lucas Sinclair Ajax Petropolus/Enid Sinclair Other Relationship Tags to Be AddedWednesday Addams Xavier Thorpe Will Byers Enid Sinclair Maxine ""Max"" Mayfield Lucas Sinclair Dustin Henderson Mike Wheeler Jim ""Chief"" Hopper Joyce Byers Ajax Petropolus Other Character Tags to Be AddedModern Era Alternate Universe - No Upside Down (Stranger Things) Wednesday Addams is Bad at Feelings Writer Wednesday Addams Bisexual Wednesday Addams Autistic Wednesday Addams Protective Wednesday Addams Enid Sinclair is a Ray of Sunshine Bisexual Enid Sinclair Autistic Eleven | Jane Hopper Step-Siblings Will Byers & Eleven | Jane Hopper Pansexual Eleven | Jane Hopper Autistic Maxine ""Max"" Mayfield Bisexual Maxine ""Max"" Mayfield Protective Lucas Sinclair Getting to Know Each Other|"
321,102,43087242,21 Jan 2023, Fixation by Tayayun ,English,"63,293",11/11,1798,"| Explicit| Rape/Non-Con, Underage| F/M| Complete Work|",|Rape/Non-Con UnderageHenry Creel | One | Vecna/Eleven | Jane Hopper Eleven | Jane Hopper/Two Henry Creel | One | Vecna/Eleven | Jane Hopper/TwoEleven | Jane Hopper Henry Creel | One | Vecna Two (Stranger Things)Rape Sexual Violence Explicit Sexual Content Violence Child Abuse Gang Rape Hawkins National Laboratory (Stranger Things) Torture Shameless Smut Incest Brutality trigger warning Dead Dove: Do Not Eat Rough Oral Sex Double Penetration Dark erotic asphyxiation Voyeurism Hurt No Comfort|
322,102,43488651,21 Jan 2023," Spinnin' in my highest heels, love (shinning just for you) by ghostchai ",English,"5,470",3/?,226,"| Teen And Up Audiences| Choose Not To Use Archive Warnings, No Archive Warnings Apply| No category| Work in Progress|","|Creator Chose Not To Use Archive Warnings No Archive Warnings ApplyWill Byers/Mike Wheeler Maxine ""Max"" Mayfield/Lucas Sinclair Will Byers & Lucas Sinclair Maxine ""Max"" Mayfield & Mike Wheeler Will Byers & Eleven | Jane Hopper Eleven | Jane Hopper & Mike WheelerFluff and Angst Alternate Universe - Modern Setting Aged-Up Character(s) Out of Character Alternate Universe - Boarding School Kinda but like will and el dont live there like in young royals Alternate Universe - No Upside Down (Stranger Things) Greek Mythology - Freeform instead of upside down i took a lot of creative liberty also im projecting SO will is latino latinas4willbyers but i might give him both mommy and daddy issues sorry - Freeform|"
323,102,44427916,21 Jan 2023," oh, just one night more (and then i'll close the door) by Smalls ",English,"26,680",10/20,9246,| Mature| No Archive Warnings Apply| M/M| Work in Progress|,"|No Archive Warnings ApplySteve Harrington/Eddie Munson Steve Harrington & Dustin Henderson Steve Harrington & The Party Steve Harrington & Jim ""Chief"" Hopper Steve Harrington & Joyce Byers Robin Buckley & Steve HarringtonSteve Harrington Eddie Munson Robin Buckley The Party (Stranger Things) Nancy Wheeler Jonathan Byers Joyce Byers Jim ""Chief"" Hopper Other Character Tags to Be Added Tommy HaganFix-It Angst Fluff Hurt/Comfort Emotional Hurt/Comfort Getting Together Friends to Lovers Slow Burn like real slow yall Time Travel Pre-Canon Post-Canon Temporary Character Death Eventual Smut Bisexual Steve Harrington Steve Harrington Has a Bisexual Awakening Steve Harrington Has Bad Parents Protective Eddie Munson playing fast and loose with timeline canon is whatever i say it is Other Additional Tags to Be Added Guidance Counselor Steve Harrington Implied/Referenced Child Abuse|"
